<?xml version="1.0" encoding="UTF-8"?>

	<!ELEMENT konyvek (konyv*)>
	<!ELEMENT konyv (cím, kiadásiev, kiado, szerzo+)>
		<!ATTLIST konyv id ID #REQUIRED>
		<!ELEMENT cím (#PCDATA)>
		<!ELEMENT kiadásiev (#PCDATA)>
		<!ELEMENT kiado (#PCDATA)>
		<!ELEMENT szerzo (#PCDATA)>
