<?xml version="1.0" encoding="UTF-8"?>
<!DOCTYPE konyvek SYSTEM "BG_konyv.dtd">
<konyvek xmlns:xsi="http://www.w3.org/2001/XMLSchema-instance" xsi:noNamespaceSchemaLocation="BG_konyv.xsd">
    <konyv id="asdfy">
        <cím>Excel 2019</cím>
        <kiadásiev>2021</kiadásiev>
        <kiado>TARAMIX Kiadó Kft.</kiado>
        <szerzo>Szabó Ildikó</szerzo>
        <abstract>Informatikai könyv</abstract>
    </konyv>
    <konyv id="yxckmna">
        <cím>Szövegbányászat és mesterséges intelligencia R-ben</cím>
        <kiadásiev>2021</kiadásiev>
        <kiado>Typotex Elektronikus Kiadó Kft.</kiado>
        <szerzo>Máté Ákos</szerzo>
        <szerzo>Ring Orsolya</szerzo>
        <szerzo>Sebők Miklós</szerzo>
        <abstract>Informatikai könyv</abstract>
    </konyv>
    <konyv id="akpmac">
        <cím>Word 2019</cím>
        <kiadásiev>2021</kiadásiev>
        <kiado>TARAMIX Kiadó Kft.</kiado>
        <szerzo>Dávid Krisztina</szerzo>
        <abstract>Informatikai könyv</abstract>
    </konyv>
    
</konyvek>
